{
  "expected_entities": [
    {
      "category": "pii",
      "end": 25,
      "entity_id": "e001",
      "field_path": "metadata.contact.note",
      "mandatory": false,
      "replacement": "[redacted:person]",
      "start": 12,
      "subtype": "person"
    },
    {
      "category": "pii",
      "end": 54,
      "entity_id": "e002",
      "field_path": "metadata.contact.note",
      "mandatory": false,
      "replacement": "[redacted:email]",
      "start": 29,
      "subtype": "email"
    }
  ],
  "expected_failure_reason": null,
  "expected_outcome": "sanitized",
  "preservation_assertions": [],
  "protected_fields": [],
  "record_id": "nested-meta-001",
  "schema_version": 1
}
