{
  "expected_entities": [
    {
      "category": "pii",
      "end": 59,
      "entity_id": "e001",
      "field_path": "excerpt",
      "mandatory": false,
      "replacement": "[redacted:address]",
      "start": 20,
      "subtype": "address"
    },
    {
      "category": "pii",
      "end": 82,
      "entity_id": "e002",
      "field_path": "excerpt",
      "mandatory": false,
      "replacement": "[redacted:account_id]",
      "start": 74,
      "subtype": "account_id"
    },
    {
      "category": "pii",
      "end": 28,
      "entity_id": "e003",
      "field_path": "title",
      "mandatory": false,
      "replacement": "[redacted:person]",
      "start": 15,
      "subtype": "person"
    }
  ],
  "expected_failure_reason": null,
  "expected_outcome": "sanitized",
  "preservation_assertions": [],
  "protected_fields": [],
  "record_id": "mixed-entities-002",
  "schema_version": 1
}
