{
  "expected_entities": [
    {
      "category": "pii",
      "end": 31,
      "entity_id": "e001",
      "field_path": "excerpt",
      "mandatory": false,
      "replacement": "[redacted:person]",
      "start": 18,
      "subtype": "person"
    },
    {
      "category": "pii",
      "end": 102,
      "entity_id": "e002",
      "field_path": "excerpt",
      "mandatory": false,
      "replacement": "[redacted:email]",
      "start": 77,
      "subtype": "email"
    }
  ],
  "expected_failure_reason": null,
  "expected_outcome": "sanitized",
  "preservation_assertions": [],
  "protected_fields": [
    {
      "expected_value_sha256": "sha256:22e0ad56e0bdab022db28fd1dd8d8d5dbbaeaf3a52899434022e05a7ad88671b",
      "field_path": "source_ref.source_id"
    },
    {
      "expected_value_sha256": "sha256:0fdc8cac0d499b0b1705c5269d65b9f29607a676d01e2ef9355aae952b2e9afd",
      "field_path": "source_ref.ref"
    },
    {
      "expected_value_sha256": "sha256:a4c58ce1b7b216548d07ebf2316aa7744d93e28cbb0ec803200bbdb0c6fa93a7",
      "field_path": "provider_event_id"
    },
    {
      "expected_value_sha256": "sha256:5f9098b899e5227a91d0eaf3fcdd4a9496d6f9dd701bbbc81b6aafe9007848b8",
      "field_path": "provider_resource_id"
    },
    {
      "expected_value_sha256": "sha256:26f5afbf48e7adc4c2e164cfc12ecb275d991814af204c6449eff530326ecf29",
      "field_path": "evidence_id"
    },
    {
      "expected_value_sha256": "sha256:249f075a3c1e2e0fe5b702ac50a161fb3dea43adc16643cda173682c9e394438",
      "field_path": "timestamp"
    }
  ],
  "record_id": "shape-observation-001",
  "schema_version": 1
}
