{
  "expected_entities": [
    {
      "category": "phi",
      "end": 32,
      "entity_id": "e001",
      "field_path": "excerpt",
      "mandatory": true,
      "replacement": "[redacted:mrn]",
      "start": 19,
      "subtype": "mrn"
    }
  ],
  "expected_failure_reason": null,
  "expected_outcome": "sanitized",
  "preservation_assertions": [],
  "protected_fields": [],
  "record_id": "phi-mrn-001",
  "schema_version": 1
}
