{
  "expected_entities": [
    {
      "category": "pii",
      "end": 40,
      "entity_id": "e001",
      "field_path": "excerpt",
      "mandatory": false,
      "replacement": "[redacted:government_id]",
      "start": 32,
      "subtype": "government_id"
    }
  ],
  "expected_failure_reason": null,
  "expected_outcome": "sanitized",
  "preservation_assertions": [],
  "protected_fields": [],
  "record_id": "govid-passport-003",
  "schema_version": 1
}
