{
  "expected_entities": [
    {
      "category": "pii",
      "end": 68,
      "entity_id": "e001",
      "field_path": "excerpt",
      "mandatory": false,
      "replacement": "[redacted:address]",
      "start": 26,
      "subtype": "address"
    }
  ],
  "expected_failure_reason": null,
  "expected_outcome": "sanitized",
  "preservation_assertions": [],
  "protected_fields": [],
  "record_id": "address-billing-003",
  "schema_version": 1
}
