{
  "expected_entities": [
    {
      "category": "pii",
      "end": 42,
      "entity_id": "e001",
      "field_path": "excerpt",
      "mandatory": false,
      "replacement": "[redacted:phone]",
      "start": 25,
      "subtype": "phone"
    }
  ],
  "expected_failure_reason": null,
  "expected_outcome": "sanitized",
  "preservation_assertions": [],
  "protected_fields": [],
  "record_id": "phone-intl-00-003",
  "schema_version": 1
}
