{
  "expected_entities": [
    {
      "category": "pii",
      "end": 39,
      "entity_id": "e001",
      "field_path": "excerpt",
      "mandatory": false,
      "replacement": "[redacted:account_id]",
      "start": 22,
      "subtype": "account_id"
    }
  ],
  "expected_failure_reason": null,
  "expected_outcome": "sanitized",
  "preservation_assertions": [],
  "protected_fields": [],
  "record_id": "account-id-002",
  "schema_version": 1
}
