{
  "expected_entities": [
    {
      "category": "secret",
      "end": 134,
      "entity_id": "e001",
      "field_path": "metadata.emission.body",
      "mandatory": true,
      "replacement": "[redacted:azure-storage-key]",
      "start": 28,
      "subtype": "azure-storage-key"
    }
  ],
  "expected_failure_reason": null,
  "expected_outcome": "sanitized",
  "preservation_assertions": [],
  "protected_fields": [
    {
      "expected_value_sha256": "sha256:ae1eae1d76e5b7c865c4122ce366a08025842566d2d96c75cc13e6353a73db0d",
      "field_path": "source_ref.source_id"
    },
    {
      "expected_value_sha256": "sha256:07f4a70d4b3bd353ab9baf0db1da80509cf8cc1dc850e5c54584ce5ddf434dde",
      "field_path": "source_ref.ref"
    },
    {
      "expected_value_sha256": "sha256:202f83de1f9772ce7d05d17ad4854662779f5fdf13ec9c9f31a13ec525900c42",
      "field_path": "provider_event_id"
    },
    {
      "expected_value_sha256": "sha256:d59518122a507c67b562ed24fde43563b4a4a6e54df373f4f61eb460dc37a4b4",
      "field_path": "provider_resource_id"
    },
    {
      "expected_value_sha256": "sha256:c10ac080b2e443b6d1739340e1c6bf9632ec121d3210de3c6c444c215310fdb4",
      "field_path": "evidence_id"
    },
    {
      "expected_value_sha256": "sha256:51a52f95e8719ff2e6333f3added3fd7cb4d2f9d8e1856453a7b2330048e0b5e",
      "field_path": "timestamp"
    }
  ],
  "record_id": "shape-adapter-emission-002",
  "schema_version": 1
}
