{
  "expected_entities": [
    {
      "category": "pii",
      "end": 61,
      "entity_id": "e001",
      "field_path": "excerpt",
      "mandatory": false,
      "replacement": "[redacted:person]",
      "start": 49,
      "subtype": "person"
    },
    {
      "category": "pii",
      "end": 114,
      "entity_id": "e002",
      "field_path": "excerpt",
      "mandatory": false,
      "replacement": "[redacted:email]",
      "start": 83,
      "subtype": "email"
    }
  ],
  "expected_failure_reason": null,
  "expected_outcome": "sanitized",
  "preservation_assertions": [
    {
      "assertion_id": "preserve-001",
      "field_path": "excerpt",
      "required_substring": "every incident gets a named scribe"
    }
  ],
  "protected_fields": [],
  "record_id": "requirement-email-person-001",
  "schema_version": 1
}
