{
  "expected_entities": [
    {
      "category": "pii",
      "end": 52,
      "entity_id": "e001",
      "field_path": "excerpt",
      "mandatory": false,
      "replacement": "[redacted:email]",
      "start": 21,
      "subtype": "email"
    }
  ],
  "expected_failure_reason": null,
  "expected_outcome": "sanitized",
  "preservation_assertions": [],
  "protected_fields": [],
  "record_id": "email-subaddress-002",
  "schema_version": 1
}
