{
  "expected_entities": [
    {
      "category": "pii",
      "end": 13,
      "entity_id": "e001",
      "field_path": "excerpt",
      "mandatory": false,
      "replacement": "[redacted:person]",
      "start": 0,
      "subtype": "person"
    }
  ],
  "expected_failure_reason": null,
  "expected_outcome": "sanitized",
  "preservation_assertions": [],
  "protected_fields": [],
  "record_id": "person-plain-001",
  "schema_version": 1
}
