{
  "expected_entities": [
    {
      "category": "pii",
      "end": 29,
      "entity_id": "e001",
      "field_path": "excerpt",
      "mandatory": false,
      "replacement": "[redacted:person]",
      "start": 16,
      "subtype": "person"
    },
    {
      "category": "pii",
      "end": 32,
      "entity_id": "e002",
      "field_path": "metadata.webhook.issue.title",
      "mandatory": false,
      "replacement": "[redacted:person]",
      "start": 19,
      "subtype": "person"
    },
    {
      "category": "pii",
      "end": 49,
      "entity_id": "e003",
      "field_path": "metadata.webhook.issue.body",
      "mandatory": false,
      "replacement": "[redacted:email]",
      "start": 24,
      "subtype": "email"
    },
    {
      "category": "pii",
      "end": 74,
      "entity_id": "e004",
      "field_path": "metadata.webhook.issue.body",
      "mandatory": false,
      "replacement": "[redacted:phone]",
      "start": 59,
      "subtype": "phone"
    }
  ],
  "expected_failure_reason": null,
  "expected_outcome": "sanitized",
  "preservation_assertions": [],
  "protected_fields": [
    {
      "expected_value_sha256": "sha256:aea85016c1ec0c25487f5fc1a3aad9e545bf2bda98f28a375945114a9920f5fb",
      "field_path": "source_ref.source_id"
    },
    {
      "expected_value_sha256": "sha256:64cfca3ff1a7d9de074b5bc498b49aee92d68cc9a59d71363c73b4de4c7113bb",
      "field_path": "source_ref.ref"
    },
    {
      "expected_value_sha256": "sha256:cf5b316deeba77dc034033756ecae4934e707c1de0da0112cbbaf0742a4bddea",
      "field_path": "provider_event_id"
    },
    {
      "expected_value_sha256": "sha256:22d6ceb0f0c08357b3989f85066419669dfc1ed3bd6eaaf62b5cac37716ad0a7",
      "field_path": "provider_resource_id"
    },
    {
      "expected_value_sha256": "sha256:b89e789777cf3832f31c6e56f748af07c8392201ebfbc87b9bbb38153387514f",
      "field_path": "evidence_id"
    },
    {
      "expected_value_sha256": "sha256:08456d2a366f4a13a5b1a3a7e994ec7a6e71eb661d69df57392347c68e2b55b7",
      "field_path": "timestamp"
    }
  ],
  "record_id": "shape-github-webhook-issue-001",
  "schema_version": 1
}
