{
  "expected_entities": [
    {
      "category": "pii",
      "end": 10,
      "entity_id": "e001",
      "field_path": "excerpt",
      "mandatory": false,
      "replacement": "[redacted:person]",
      "start": 0,
      "subtype": "person"
    },
    {
      "category": "pii",
      "end": 51,
      "entity_id": "e002",
      "field_path": "excerpt",
      "mandatory": false,
      "replacement": "[redacted:email]",
      "start": 29,
      "subtype": "email"
    },
    {
      "category": "pii",
      "end": 70,
      "entity_id": "e003",
      "field_path": "excerpt",
      "mandatory": false,
      "replacement": "[redacted:phone]",
      "start": 55,
      "subtype": "phone"
    },
    {
      "category": "pii",
      "end": 86,
      "entity_id": "e004",
      "field_path": "excerpt",
      "mandatory": false,
      "replacement": "[redacted:ip]",
      "start": 76,
      "subtype": "ip"
    }
  ],
  "expected_failure_reason": null,
  "expected_outcome": "sanitized",
  "preservation_assertions": [],
  "protected_fields": [],
  "record_id": "mixed-entities-001",
  "schema_version": 1
}
