{
  "expected_entities": [
    {
      "category": "pii",
      "end": 34,
      "entity_id": "e001",
      "field_path": "metadata.fetch.body",
      "mandatory": false,
      "replacement": "[redacted:person]",
      "start": 22,
      "subtype": "person"
    },
    {
      "category": "pii",
      "end": 90,
      "entity_id": "e002",
      "field_path": "metadata.fetch.body",
      "mandatory": false,
      "replacement": "[redacted:email]",
      "start": 66,
      "subtype": "email"
    }
  ],
  "expected_failure_reason": null,
  "expected_outcome": "sanitized",
  "preservation_assertions": [],
  "protected_fields": [
    {
      "expected_value_sha256": "sha256:6660644afa34410075be814f24b637b3f3fa20c769e4ba7ec322d67eb1ca621a",
      "field_path": "source_ref.source_id"
    },
    {
      "expected_value_sha256": "sha256:bedfb9e80b77cb62e01f63f0e0183143cf66220b519b09a2d9056484a37caee9",
      "field_path": "source_ref.ref"
    },
    {
      "expected_value_sha256": "sha256:ba9abdb4467911772e4edaaeac701f3b42adff5dca811f8a146e0753f4a7485e",
      "field_path": "provider_event_id"
    },
    {
      "expected_value_sha256": "sha256:1a413a437a984487c02b184857b3f366ffe3a9e8b00e8f72e8888f27cb908d76",
      "field_path": "provider_resource_id"
    },
    {
      "expected_value_sha256": "sha256:ebb0a075e62d00bcf06f58bb727dc9572d5d6c90158ba2b79ce4b6c13cbe02ec",
      "field_path": "evidence_id"
    },
    {
      "expected_value_sha256": "sha256:ce093b8fc5ba1beeaa40c1c50b0a18298bf9e0ad065925ff5c10644e6979c5dc",
      "field_path": "timestamp"
    }
  ],
  "record_id": "shape-bounded-document-fetch-001",
  "schema_version": 1
}
