{
  "expected_entities": [
    {
      "category": "secret",
      "end": 49,
      "entity_id": "e001",
      "field_path": "excerpt",
      "mandatory": true,
      "replacement": "[redacted:slack-token]",
      "start": 16,
      "subtype": "slack-token"
    },
    {
      "category": "secret",
      "end": 93,
      "entity_id": "e002",
      "field_path": "excerpt",
      "mandatory": true,
      "replacement": "[redacted:google-api-key]",
      "start": 54,
      "subtype": "google-api-key"
    }
  ],
  "expected_failure_reason": null,
  "expected_outcome": "sanitized",
  "preservation_assertions": [],
  "protected_fields": [],
  "record_id": "secret-slack-google-003",
  "schema_version": 1
}
